title,link,source,journalist,date,content,classification
What To Know About Beef Tallow,https://theonion.com/what-to-know-about-beef-tallow/,The Onion,,2025-03-20T10:18:11-05:00,"Beef tallow, also known as rendered beef fat, is trending among beauty and health influencers. Here is everything you need to know about the by-product.

Q: What is beef tallow used for?

A: Cooking, skincare, and fixing squeaky cows.

Q: Why should I cook with it?

A: To crisp up those soft, supple arteries.

Q: Where can I get beef tallow?

A: Nail a metal tap into the side of a cow and let the liquid run into a bucket.

Q: Is it true that RFK Jr. cooked his Thanksgiving turkey in tallow?

A: No, but he did cook his Thanksgiving mountain lion in tallow.

Q: What are the benefits of eating beef tallow?

A: You can rest easy knowing that no part of your meal was made without animal suffering.

Q: What is the main benefit of using beef tallow as a facial moisturizer?

A: It helps grow your tradwife TikTok account.

Q: Will it really make my skin look better?

A: Have you ever seen a cow with acne?

Q: How do I apply it?

A: Just lie down under the deep fryer at your local Carl’s Jr. and let gravity do the rest.

",0
Trump Announces SEAL Team 6 Killed U.S. Protester In Daring Overnight Raid,https://theonion.com/trump-announces-seal-team-6-killed-u-s-protester-in-daring-overnight-raid/,The Onion,,2025-03-20T09:35:17-05:00,"WASHINGTON—Addressing the nation to reveal that one of the greatest threats facing the country had been eradicated, President Donald Trump announced Thursday that SEAL Team Six had killed a U.S. protester in a daring overnight raid. “Tonight, I can report to the American people and to the world that the United States has conducted an operation that killed Daniel J. McLeigh, the notorious activist responsible for dozens of peaceful protests on the University of Pennsylvania campus,” said the commander-in-chief, describing the moment in the Situation Room when he ordered a Navy SEAL special missions unit to land on the university’s quad, raid a freshman dormitory, and eliminate the undergrad with extreme prejudice as “the proudest of his presidency.” “These boys flew in under the cover of darkness. They used night-vision goggles and thermal tracking to make sure we never lost track of the target. We did have to abandon one Black Hawk helicopter after it crashed into the dining hall, but that’s a small price to pay for making sure we’ll never again live in fear of this English major. More details will be released in the coming days, but for now I’ll just say this: We got him. We got him, folks. Thank you. May God bless you. And may God bless the United States of America.” The White House also released a statement confirming the 19-year-old’s body had been buried in the Delaware River so that he would not have a grave that became a site of pilgrimage for other politically engaged citizens.

",0
Study: 93% Of Individuals With One Earbud In Receiving Top-Secret Commands From HQ,https://theonion.com/study-93-of-individuals-with-one-earbud-in-receiving-top-secret-commands-from-hq/,The Onion,,2025-03-20T08:00:00-05:00,"WASHINGTON—Despite the risks to national security from revealing such confidential information, the Pew Research Center released a study Thursday proving that 93% of individuals with one earbud in are receiving top-secret commands from HQ. “Nearly every person you see in public wearing a single earbud is currently undertaking a clandestine mission on behalf of an undisclosed government agency,” the report read in part, going on to state that the increase in persons wearing one earbud was directly correlated to the decrease in access to phone booths where agents would have previously accepted their assignments. “The man on the bus bobbing his head to “music” is actually carrying out a covert hit via a directive from headquarters. Same with the woman at the grocery store engaging in a “phone call” with her “sister.” These operatives are highly skilled at blending in with the public while they wait for confirmation that Operation Sidewinder is a go. Then they move into position and take out their target.” While a spokesperson for the Defense Department dismissed the findings as “total fiction,” the study also found that the Pentagon is the No. 1 purchaser of earbuds in the country.

",0
New Federal Law Mandates Women Talk With Baby Voice,https://theonion.com/new-federal-law-mandates-women-talk-with-baby-voice/,The Onion,,2025-03-19T08:00:00-05:00,"WASHINGTON—In a decisive victory for longtime champions of the cause, congressional leaders announced Wednesday the passage of a new federal law mandating that all women talk with a baby voice. “Under the terms of this legislation, every American female over the age of 18 is now required to speak with short, simple words in a high vocal register,” said Senate Majority Leader John Thune, underlining the Republican mission of paring down the vocabularies of every adult woman in the United States to a maximum of five words, including “night night,” “wuv,” and “tummy.” “This goes for all women, including my Senate colleagues: You must immediately tie your hair into pigtails and replace your standard laugh with a coquettish giggle. Any woman not wearing a schoolgirl uniform will be considered to have acted in direct violation of this law, as will any woman who refers to a man by any term other than ‘daddy.’” Thune went on to express his support for a similar law that would require all the nation’s men to lower their voices by at least two octaves and communicate solely through grunts.

",0
JD Vance Reminded Caddies Not Allowed In Clubhouse,https://theonion.com/jd-vance-reminded-caddies-not-allowed-in-clubhouse/,The Onion,,2025-03-18T08:00:00-05:00,"WEST PALM BEACH, FL—Finding himself stopped upon entering a building at the Trump International Golf Club, Vice President JD Vance was reportedly reminded by a staff member Tuesday that caddies are not allowed in the clubhouse. “Sir, sir, you can’t go in there,” said head of guest services Melanie Cole, gently taking the vice president by the elbow and escorting him back out the front door. “We can’t have caddies scrounging for tips around the dining area. If you’re looking for a restroom or somewhere to wash off your shoes, you’ll find everything you need in the caddy shack down the road. And the host stand will radio if you’re needed by a club member, all right? Now I don’t want to see you in here again, or we’ll have to dock your pay.” Cole added privately that she suspected Vance was the one stealing golf pencils.

",0
"Dejected Schumer Superfan Can’t Believe He Dropped $10,000 On VIP Party Package",https://theonion.com/dejected-schumer-superfan-cant-believe-he-dropped-10000-on-vip-party-package/,The Onion,,2025-03-17T12:38:08-05:00,"BALTIMORE—In the wake of news that the New York senator had postponed his book tour amid controversy over his vote for a spending bill, dejected Chuck Schumer superfan Sean Angston told reporters Monday that he couldn’t believe he had dropped $10,000 on a VIP party package. “Chuck is basically my idol, so I can’t tell you how excited I was to do that backstage champagne toast with him and get the autographed tote bag,” said Angston, who went on to express reservations about ever buying the Chuck Schumer VIP Party Experience again after seeing how the minority leader had treated ardent fans who had sunk thousands on a supposedly “unforgettable meet and greet” with him. “If they’re gonna offer these VIP packages, they need to realize they’re playing with the dreams of fans. At this point, it doesn’t matter if they mail me the limited-edition poster with his headshot on it. Too little, too late in my book. This totally ruined my birthday plans, too.” At press time, Angston had announced plans to get over the disappointment by purchasing a Preshow Party Package with Sen. Michael Bennet featuring specialty Bennet-themed cocktails.

",0
JD Vance’s French Horn Solo Booed At Kennedy Center,https://theonion.com/jd-vances-french-horn-solo-booed-at-kennedy-center/,The Onion,,2025-03-14T13:34:36-05:00,"WASHINGTON—Failing to receive the reaction he anticipated from audience members, JD Vance was booed at the John F. Kennedy Center for the Performing Arts while playing a French horn solo, sources confirmed Friday. The stage curtains reportedly rose to reveal the vice president, an amateur horn player, standing by himself behind a music stand, a sight that elicited gasps and murmurs from those in attendance. According to sources, the crowd began booing and jeering Vance within the first 15 seconds of his performance of Franz Strauss’s Horn Concerto, Op. 8, causing the vice president to quickly lose his confidence and begin playing cracked and flat notes. Several reports indicated that the vice president attempted to make eye contact with his wife, second lady Usha Vance, who sat in the box tier, but she only looked away and stared down at her hands. At press time, Vance was said to have dropped his French horn to the floor and run off the stage in tears, knocking over the music stand in the process.

",0
RFK Jr. Claims Measles Can Be Cured With A Good Concealer,https://theonion.com/rfk-jr-claims-measles-can-be-cured-with-a-good-concealer/,The Onion,,2025-03-14T12:55:47-05:00,"WASHINGTON—In the wake of a growing outbreak that has sickened hundreds and killed two in West Texas and New Mexico, Health and Human Services Secretary Robert F. Kennedy Jr. claimed Friday that measles could be cured with a good concealer. “If you contract measles or suspect you have contracted measles, I recommend immediately applying a high-quality, full-coverage liquid or cream color corrector to affected areas,” said Kennedy, who added that HHS was rushing to distribute facial cleanser, foundation, and 10-ounce tubes of L’Oréal Infallible to pharmacies in the region. “Our nation’s top infectious disease doctors recommend anyone who has been exposed to measles immediately use a ring light to assess their skin, apply a dab of 24-hour concealer, and then smooth with a brush or Beautyblender makeup sponge. The truth is, if Americans just had proper access to lightweight cosmetic products capable of hiding blemishes, eliminating uneven skin tone, and highlighting natural complexion, measles could be eradicated.” At press time, Kennedy had released a makeup tutorial where he demonstrated how to apply concealer manufactured by his wife Cheryl Hines’ makeup company for extra measles protection.

",0
Report: More Americans Moving Away From Urban Areas For Rural Life Where They Have Escalating Feud With Beaver,https://theonion.com/report-more-americans-moving-away-from-urban-areas-for-rural-life-where-they-have-escalating-feud-with-beaver/,The Onion,,2025-03-14T08:00:00-05:00,"CAMBRIDGE, MA—Suggesting the reversal of a longstanding historical trend towards urbanization, a report published Tuesday by researchers at Harvard University revealed that more Americans were moving away from cities to pursue a rural life where they have an escalating feud with a beaver. “Our findings indicate there has been a 15% increase in Americans who trade the hustle and bustle of metropolitan life for an agrestic existence in which they dismantle a small beaver dam on their property, leading the determined rodent to seek retribution,” said the report’s lead author, Keith Rawlings, noting that rising rents and concerns about crime had driven even long-term city dwellers to purchase a secluded woodland home whose walls, cabinets, and tables would ultimately be gnawed into a series of elaborate booby traps by the vengeful beaver and his family. “More U.S. citizens are leaving behind the nightlife and cultural events of large urban centers, preferring to spend their disposable income on a faulty beaver-trapping kit, an eccentric exterminator who will end up poisoning himself, and a two-barrel shotgun they will use to destroy their remaining possessions in a desperate pursuit of the elusive semiaquatic mammal. While many say they miss the convenience and variety of cities, they nonetheless prefer a country life in which they realize the beaver would make the perfect mascot for the big ad campaign they’ve been working on and ultimately learn to live in peace with the creature.” Rawlings added that, by contrast, a relatively negligible number of Americans were choosing to leave rural areas in pursuit of an urban life in which they befriend a wise-cracking pigeon.

",0
Elon Musk Creates Federal Employee Revenge Porn Database,https://theonion.com/elon-musk-creates-federal-employee-revenge-porn-database/,The Onion,,2025-03-11T08:00:00-05:00,"WASHINGTON—Promising to use the U.S. DOGE Service to usher in a new age of government accountability and transparency, Elon Musk ordered the creation of a federal employee revenge porn database this week. “Federal employees have been lazy and unmotivated for years, so to ensure productivity going forward, all government workers must email me private nudes they would never want leaked,” said Musk, who warned members of the U.S. civil service that failing to send in a sexually explicit video in which their face was clearly visible would be considered a resignation. “In the event of insubordination or noncompliance with executive orders, these private porn videos will be immediately posted to Pornhub and other sites using the employee’s full name. I don’t want any of that softcore shit either—only videos with full penetration or clear oral sex acts will be considered valid. DOGE employees and myself will be personally reviewing each video to ensure compliance and will reject any videos deemed not explicit enough.” Musk added that for any federal employee who does not currently have a qualifying sex tape, AI would be used to create one.

",0
Report Finds Ticketmaster Controls 80% Of Nation’s Middle School Talent Shows,https://theonion.com/report-finds-ticketmaster-controls-80-of-nations-middle-school-talent-shows/,The Onion,,2025-03-11T08:00:00-05:00,"WEST HOLLYWOOD, CA—In a new revelation shedding further light on the ticket sales and distribution giant’s alleged monopoly, a bombshell report published Tuesday found that Ticketmaster controls 80% of America’s middle school talent shows. “Ticketmaster retains the exclusive booking rights to thousands of middle school auditoriums across the country, creating an out-of-control resale market that prices out parents hoping to see their children perform amateur flute solos or tap routines set to Kidz Bop renditions of pop songs,” said researcher and report co-author Alyssa Cade, whose findings also revealed that scammers and bots take advantage of Ticketmaster’s stranglehold on talent shows, often reselling tickets for 10 times their original price. “This monopoly means that Ticketmaster is essentially engaging in price-gouging, forcing parents to spend $200 to $300 on a ticket that was originally guaranteed with the donation of one canned good.” Reached for comment, Ticketmaster defended its sales practices by claiming it was only fair that both the company and middle schools received a cut of sales.

",0
Nation Uses Extra Hour Of Daylight To Sun Perineums Even Harder,https://theonion.com/nation-uses-extra-hour-of-daylight-to-sun-perineums-even-harder/,The Onion,,2025-03-10T13:52:48-05:00,"CLEVELAND—Excitedly heading out to yards, balconies, and public parks across the country to reap the wellness benefits, the U.S. populace confirmed Monday that it was using the extra hour of daylight to sun its perineums even harder. “If you thought I was serious about my health before, just wait and see what another whole hour of basking my taint in direct sunlight does for my libido, circulation, and mood,” said Ohio resident Elena Nelson, echoing the sentiment of 340 million Americans who had removed their pants and underwear, laid on their backs with their legs raised, and enthusiastically sunned the region between their anus and genitals until the last of the day’s light. “That lost hour of sleep is a small price to pay to bring my perineum-sunning to the next level. Squatting over a SAD lamp gets me through the winter, but it just doesn’t hold a candle to soaking up actual solar goodness. C’mon, everyone! Let’s spring forward into tanning those gooches!” At press time, millions of perineal carcinomas added that they were feeling a lot more energized, too.

",0
Trump Says Recession Unfortunate But Necessary Step To Get To Depression,https://theonion.com/trump-says-recession-unfortunate-but-necessary-step-to-get-to-depression/,The Onion,,2025-03-10T13:08:44-05:00,"WASHINGTON—Warning that Americans should brace themselves for an economic “period of transition,” President Donald Trump told reporters Monday that a recession would be an unfortunate but necessary step on the way to all-out depression. “Look, what we’re doing is very big and will cause some pain, but that pain is necessary to cause total economic collapse,” Trump said during a press conference, adding that while his decision to implement billions of dollars in tariffs on foreign imports and fire 20,000 federal workers could cause a temporary disturbance, Americans would ultimately emerge much, much worse for it. “Things might be bad for a little while, but we’re okay with that, because we know that in the end these policies will drive markets into a deadly tailspin and push the economy to a point of no return. Trust me. Some hardship now will only make your bank accounts more empty in the long run. If everything goes right, none of you will be able to afford food, housing, or retirement ever again.” At press time, many of Trump’s most vocal defenders stressed that they trusted the president to usher in the greatest depression the nation had ever seen.

",0
DHS Begins National Registry Of Duolingo Users,https://theonion.com/dhs-begins-national-registry-of-duolingo-users/,The Onion,,2025-03-10T08:00:00-05:00,"WASHINGTON—Warning that the highly suspicious individuals constituted a threat to the country’s safety and cultural unity, the U.S. Department of Homeland Security announced plans Monday to create a national registry of Duolingo users. “For unknown reasons, there are people in this country attempting to learn foreign languages ranging from Italian to Japanese, and we need to remain vigilant in the face of what they might be preparing,” said Homeland Security Secretary Kristi Noem, warning that any Duolingo user who had earned a Social Butterfly or Flawless Finisher badge was not a real American and did not share the country’s values. “As a result of the Biden administration’s lax enforcement, the number of potentially dangerous Duolingo users in the country has jumped to over 75 million. Many of them have kept a streak alive for months. Anyone currently living in the country and earning XP on Duolingo must comply and register with the government or face deportation. We encourage citizens to report any neighbors they witness reciting phrases like ‘Lo siento’ or ‘Perdón’ into their phone.” Noem added that while most users were safe from punitive action at this time, anyone on the Duolingo leaderboards would be targeted immediately for extradition to Guantánamo Bay.

",0
Noom Weight Loss Quiz Guarantees Personalized Insults Tailored To Users’ Insecurities,https://theonion.com/noom-weight-loss-quiz-guarantees-personalized-insults-tailored-to-users-insecurities/,The Onion,,2025-03-10T08:00:00-05:00,"NEW YORK—In a continued effort to harness the power of psychology to help customers achieve their fitness goals, Noom announced Monday that the company’s weight loss quiz now guarantees personalized insults tailored to users’ insecurities. “There’s no one-size-fits-all approach to getting healthy, which is why the Noom team is proud to provide specific and detailed put-downs that will hit users directly where they are most vulnerable,” said CEO Geoff Cook, telling reporters that while generic taunts such as “tubby” or “lardo” could provide a small amount of motivation, they were nowhere near as effective as individualized jabs about the unsightliness of a user’s specific body parts generated by Noom’s proprietary algorithm. “Simply download the app and begin answering questions about your body type and exercise habits, and in a matter of minutes, Noom will be able to identify that, say, everyone is laughing at you behind your back because of the way your arm flab jiggles, or that your pathetic, untoned stomach would probably make any potential lovers throw up on sight.” Cook added that users of the app can also track their eating habits by inputting food they have consumed into the Noom calorie counter while it loudly oinks.

",0
Trump’s North American Tariffs: Myth Vs. Fact,https://theonion.com/trumps-north-american-tariffs-myth-vs-fact/,The Onion,,2025-03-10T08:00:00-05:00,"President Trump’s plans for tariffs, including on goods from Canada and Mexico, have left many consumers and investors uneasy.The Onionseparates the facts from the myths.

MYTH: Tariffs will revitalize the American auto industry.

FACT: Only the second coming of the Ford Fiesta could do that.

MYTH: Trump has imposed 25% tariffs on Mexico and Canada.

FACT: Actually this is true, no wait it’s a myth now, and, fuck, no wait.

MYTH: Tariffs will raise prices.

FACT: It’s only possible for prices to rise when a Democrat is president.

Myth: Tariffs will bring back American manufacturing jobs.

Fact: Christ, give it up, Grandpa. The plant has been closed since 1982.

MYTH: Tariffs are taxes.

FACT: Tariffs are the little things: a smile between strangers, the smell of a freshly poured cup of coffee, or the laughter of a child.

MYTH: Tariffs will help crack down on illegal drugs entering at the borders.

FACT: Tariffs will protect the U.S. fentanyl industry.

MYTH: Tariffs may trigger a global recession.

FACT: They have triggered a global recession.

",0
